<?xml version="1.0" encoding="UTF-8"?>
<!DOCTYPE guitar_shop SYSTEM "file:/C:\Users\lenovo\Documents\Visual Studio 2012\Projects\GuitarShop\GuitarShop\App_Data\kitari.dtd">
<guitar_shop GuitarShopID="GS19" name="китара БГ">
    <contacts>
        <adress>София, ул. "Коста Лулчев" 52</adress>
        <phone>0899251326</phone>
        <email>sky-city@mci-bg.com</email>
        <website>kitara.bg</website>
    </contacts> 
    <guitars>
        <guitar>
            <electric_guitar manufacturer="Fender" model="Future Tribute VS" num_strings="8" num_frets="24">
                <description>RG серията е най-разпознаваемата и отличаваща се сред продуктите на Ibanez.
                    Ibanez RGIX28FEQM-BGW е с Gibraltar Standard II-8 бридж и съчетава всички качества на прецизна изработка 
                    на тези инструменти.
                </description>
                <price value="540" currency="BGN"/>
                <body>
                    <solid_body body_type="Flying_V"/>
                </body>
                <pickups>
                    <pickup>
                        <pickup_type>
                            <magnetic type="single-coil"/>
                        </pickup_type>
                        <position pos="neck"/>
                    </pickup>
                    <pickup>
                        <pickup_type>
                            <magnetic type="single-coil"/>
                        </pickup_type>
                        <position pos="middle"/>
                    </pickup>
                    <pickup>
                        <pickup_type>
                            <magnetic type="humbucker"/>
                        </pickup_type>
                        <position pos="bridge"/>
                    </pickup>
                </pickups>
                <pickguard>Да</pickguard>
                <tremolo_bar>Да</tremolo_bar>
            </electric_guitar>
        </guitar>
        <guitar>
            <electric_guitar manufacturer="Gibson" model="GRG121DX BKF" num_strings="7" num_frets="22">
                <description>Черен матов цвят</description>
                <price value="1419" currency="USD"/>
                <body>
                    <solid_body body_type="Explorer"/>
                </body>
                <pickups>
                    <pickup>
                        <pickup_type>
                            <magnetic type="humbucker"/>
                        </pickup_type>
                        <position pos="neck"/>
                    </pickup>
                    <pickup>
                        <pickup_type>
                            <magnetic type="humbucker"/>
                        </pickup_type>
                        <position pos="bridge"/>
                    </pickup>
                </pickups>
            </electric_guitar>
        </guitar>
        <guitar>
            <acoustic_guitar electro-acoustic="Yes">
                <steel-stringed num_strings="6" manufacturer="Fender" model="V72ECE-BK">
                    <price value="360" currency="EUR"/>
                    <body_type body="Dreadnought"/>
                    <description>електро-акустична китара</description>
                </steel-stringed>
            </acoustic_guitar>
        </guitar>
    </guitars>
    <amplifiers>
        <amplifier manufacturer="Ibanez" model="TSA15-U" type="hybrid">
            <price value="373" currency="EUR"/>
            <description>Няма</description>
            <power value="15" unit="Watt"/>
        </amplifier>
    </amplifiers>
    <strings>
        <acoustic_guitar_strings manufacturer="Fender" gauge="0.11">
            <price value="7.99" currency="BGN"/>
            <description>Метални струни за акустична китара. Размери на струните 011-013-021-033-039-048 Струните са от фосфор и бронз. Струните са изработени по специална технология. Характеризират се с приятен тембър, добро звучене, издръжливост. Струните KING LION са харесвани от много музиканти.</description>
        </acoustic_guitar_strings>
        <electric_guitar_strings manufacturer="Dunlop" gauge="0.9">
            <price value="7.99" currency="BGN"/>
            <description>Струни за електрическа китара KING LION 009-042. Никелови. Изработени по специална технология. Характеризират се с приятен тембър, добро звучене, издръжливост. Струните KING LION са харесвани от много музиканти.</description>
        </electric_guitar_strings>
        <classical_guitar_strings manufacturer="KING" gauge="0.27">
            <price value="7.99" currency="BGN"/>
            <description>Найлонови струни за класическа китара. Размерът на струните е .027 .034 .041 .031 .036 .044 Струните са изработени по специална технология. Характеризират се с приятен тембър, добро звучене, издръжливост. Струните KING LION са харесвани от много музиканти.</description>
        </classical_guitar_strings>        
    </strings>
</guitar_shop>