<?xml version="1.0" encoding="UTF-8"?>
<!DOCTYPE guitar_shop SYSTEM "file:/C:\Users\lenovo\Documents\Visual Studio 2012\Projects\GuitarShop\GuitarShop\App_Data\kitari.dtd">
<guitar_shop GuitarShopID="GS6" name="музикален магазин">
    <contacts>
        <adress>София, ул. "Коста Лулчев" 52</adress>
        <phone>028705105</phone>
        <email>sky-city@mci-bg.com</email>
        <website>mci-bg.com</website>
    </contacts>    
    <guitars>
        <guitar>
            <electric_guitar manufacturer="Ibanez" model="RGIX28FEQM-BGW" num_strings="8" num_frets="24">
                <description>RG серията е най-разпознаваемата и отличаваща се сред продуктите на Ibanez.
                    Ibanez RGIX28FEQM-BGW е с Gibraltar Standard II-8 бридж и съчетава всички качества на прецизна изработка 
                    на тези инструменти.
                </description>
                <price value="1758" currency="BGN"/>
                <body>
                    <solid_body body_type="Stratocaster"/>
                </body>
                <pickups>
                    <pickup>
                        <pickup_type>
                            <magnetic type="humbucker"/>
                        </pickup_type>
                        <position pos="neck"/>
                    </pickup>
                    <pickup>
                        <pickup_type>
                            <magnetic type="humbucker"/>
                        </pickup_type>
                        <position pos="bridge"/>
                    </pickup>
                </pickups>
            </electric_guitar>
        </guitar>
        <guitar>
            <electric_guitar manufacturer="Ibanez" model="RGIX27FEQM-TG" num_strings="7" num_frets="24">
                <description>
                    RG серията е най-разпознаваемата и отличаваща се сред продуктите на Ibanez.
                    Ibanez RGIX27FEQM-TG е с Gibraltar Standard II-7 бридж и съчетава всички качества
                    на прецизна изработка на тези инструменти.
                </description>
                <price value="1562" currency="BGN"/>
                <body>
                    <solid_body body_type="Stratocaster"/>
                </body>
                <pickups>
                    <pickup>
                        <pickup_type>
                            <magnetic type="humbucker"/>
                        </pickup_type>
                        <position pos="neck"/>
                    </pickup>
                    <pickup>
                        <pickup_type>
                            <magnetic type="humbucker"/>
                        </pickup_type>
                        <position pos="bridge"/>
                    </pickup>
                </pickups>
            </electric_guitar>
        </guitar>
    </guitars>
    <amplifiers>
        <amplifier manufacturer="Career" model="MERRIT-10" type="vacuum_tube">
            <price value="180" currency="BGN"/>
            <description>Усилвателят е идеален за домашни условия. Има вход за китара, вход за слушалки. Има контрол на силата на звука "volume", контрол на високите честоти "treble" и контрол на баса "bass". </description>
            <power value="10" unit="Watt"/>
        </amplifier>
        <amplifier manufacturer="Orange" model="CR35LDX" type="solid-state">
            <price value="450" currency="BGN"/>
            <description>Няма</description>
            <power value="35" unit="Watt"/>
        </amplifier>
    </amplifiers>
    <strings>
        <acoustic_guitar_strings manufacturer="KING LION" gauge="0.11">
            <price value="7.99" currency="BGN"/>
            <description>Метални струни за акустична китара. Размери на струните 011-013-021-033-039-048 Струните са от фосфор и бронз. Струните са изработени по специална технология. Характеризират се с приятен тембър, добро звучене, издръжливост. Струните KING LION са харесвани от много музиканти.</description>
        </acoustic_guitar_strings>
        <electric_guitar_strings manufacturer="KING LION" gauge="0.9">
            <price value="7.99" currency="BGN"/>
            <description>Струни за електрическа китара KING LION 009-042. Никелови. Изработени по специална технология. Характеризират се с приятен тембър, добро звучене, издръжливост. Струните KING LION са харесвани от много музиканти.</description>
        </electric_guitar_strings>
        <classical_guitar_strings manufacturer="KING LION" gauge="0.27">
            <price value="7.99" currency="BGN"/>
            <description>Найлонови струни за класическа китара. Размерът на струните е .027 .034 .041 .031 .036 .044 Струните са изработени по специална технология. Характеризират се с приятен тембър, добро звучене, издръжливост. Струните KING LION са харесвани от много музиканти.</description>
        </classical_guitar_strings>        
    </strings>
</guitar_shop>
